description,file_name
SLIGHTPULSE endpoint,meeting_testjs.cgi
Copies malicious logic to the new files during the patching process (allowing for persistence),licenseserverproto.cgi
Runs arbitrary commands passed via HTTP requests,secid_canceltoken.cgi
QUIETPULSE Utility script,compcheckjava.cgi
Publicly-facing page to send arbitrary commands with ID argument,compcheckresult.cgi
Allows for credential harvesting of authenticated users,login.cgi
Runs arbitrary commands passed via HTTP requests,healthcheck.cgi